start	end	text
0	2000	尊敬的全球的战友们大家好
2000	5000	今天是3月9号欢迎来到我们的文贵大直播
5000	7000	欢迎我们在座的所有嘉宾
7000	10000	那我们先请我们所有的嘉宾
10000	12000	还有齐哥跟大家先问个好
13000	15000	好 我是小王子
15000	17000	今天非常荣幸参加文贵大直播
17000	18000	谢谢
19000	20000	Tex
21000	23000	大家好 我是Tex
23000	24000	各位嘉宾好
24000	25000	齐哥好
25000	27000	兴奋 激动
27000	29000	看到现在紧锣密鼓的
29000	33000	我们正在做一件非常慎奋人心的事情
33000	35000	所以我们今天大直播应该会讲到
35000	36000	谢谢
37000	40000	齐哥好 战友们好 嘉宾们好
40000	41000	我是唐萍
42000	44000	战友们好 齐哥好
44000	45000	大家好 嘉宾好
45000	46000	我是文良王
49000	51000	齐哥早 兄弟姐妹战友们好
51000	52000	我是小飞翔
52000	54000	齐哥早 兄弟姐妹战友们好
54000	55000	我是小飞翔
57000	58000	齐哥好 兄弟姐妹们好
58000	59000	我是小飞翔
59000	61000	很荣幸再次回到这个大直播
63000	64000	好 忘了介绍我是韦琼
64000	67000	那齐哥还给您 您跟大家打声招呼
68000	70000	尊敬的战友们好 大家好
70000	72000	这我就不一念你的名字了
72000	73000	大家都知道
73000	76000	你们的名字都是想测天空
76000	77000	今天都是名角
77000	80000	今天是三对
80000	84000	只有我和泰克斯比较孤单的在这里夹著
85000	89000	但是也说明了我们放下个人情感
89000	91000	独身作战
91000	93000	这是新东联邦的精神
93000	95000	今天特别高兴
95000	97000	今天是3月9号
97000	102000	3月9号是2022年和2020年的3月9号
102000	104000	大家还记得当年发生什么事情
105000	107000	大家去想想当时我在哪直播
108000	110000	刚才我看了壹小段
110000	114000	就是说我过去直播里给大家说的今年
115000	117000	我想壹会给大家好好分享分享
117000	121000	俄无战争的本质和接下来发生的事情
122000	126000	我昨天晚上到现在睡了大概在两个半小时吧
126000	127000	两个半小时
128000	132000	在过去的这几十天可以说是我最累的
132000	134000	不是从往外累
134000	136000	在生理上累
136000	141000	在心里边各方面都是面临几个大的挑战
142000	144000	头壹段这个PASS的官司
144000	146000	共产党发起了猛烈的攻击
147000	149000	及格个人破产
149000	153000	然后接下来就是整个的锁链女的事件
153000	155000	可以说震撼了每个人的心
155000	160000	勾起了我们内心对从小和那种最痛苦的经历
160000	162000	然后就到了我母亲的三周年
162000	167000	三周年对我们山东人来讲对我来讲是个非常非常大的事
167000	169000	按照我们山东人的规矩说
169000	173000	三周年你的亲人已经真的离你远去了
173000	176000	他已经该去什么地方去什么地方了
176000	178000	是吧这种是很痛苦的
178000	184000	然后这个我母亲三周年刚刚的过这个中间前前后后
184000	186000	经锁链女和唐萍
187000	192000	我母亲三周年这个痛苦又加上壹层
192000	193000	我们写这个歌
193000	196000	这个经历的这种虐心
196000	201000	大家已经都感受到今天我们会跟我们的这个泰克斯老师
201000	203000	这个我们的唐萍老师
203000	206000	薇莲老师壹起来谈谈这个创作的过程
206000	209000	这个同时额无战争爆发
210000	213000	额无战争爆发的同时大家又看到了
213000	217000	我的个人破产的案子在法庭
217000	221000	上次的延期申请我们是60天
221000	225000	最后是对方死闹硬闹咱们乱搞
225000	228000	到了给了大概十几千
228000	233000	也就是今天下午晚上六点钟把这个所有的这个文件交上去
233000	234000	多少页呢
234000	239000	大概要可能是近万页的准备提交几千页的文件
240000	246000	他最惨的几千页文件的英文还得让我都要看到说我必须全程参与
246000	248000	还得学学个人破产法案
249000	252000	就这些东西你去想想交织在壹起
252000	256000	这时候我们又派往前线大量的战友作战
256000	258000	看到了文哥文葛鸡熊啊
258000	260000	我们的大卫兄弟啊
260000	262000	我们的所有的阿丙啊
262000	266000	以及我们刚刚到的加拿大的这个所有农场的战友
266000	268000	包括杨帆潘石啊
268000	269000	英里农场啊
269000	272000	鸡鸡农场的人都刚刚又到达了前线
272000	274000	在风雪中啊
274000	277000	我们占据了最有力的位置啊
277000	281000	我们的文哥文科在前线睡在壹个
281000	282000	用阿丙的话说
282000	286000	比国内的那个民工多多年前睡的环境还差
286000	288000	有的战友都泪吐了啊
288000	293000	而且我们创造了人类上前所未有的壹个大救援行动
293000	296000	这是我自己啊可能我无知
296000	302000	是中国人第壹次黄皮肤人真心的救白人和西方人
302000	304000	没有利益
304000	305000	没有任何权利
305000	307000	没有任何国际组织
307000	310000	而且我们救出的90多个孩子
310000	313000	壹会儿大家会听到详细细节
313000	316000	对西方的震撼是前所未有的
316000	319000	我们救出的几百个人是前所未有
319000	322000	我们救出的几百个人是前所未有
322000	324000	就在共产党七天前宣布
324000	327000	自己已经全面救出了所有中国人
327000	329000	我们又救出了那么多中国人
329000	332000	我们有些背后的故事现在不方便说
332000	334000	以后就慢慢的说
334000	336000	昨天又共产党又宣布
336000	339000	又是最后救出了所有中国人了
339000	340000	据我所知
340000	345000	新加坡人、香港人、台湾人、日本人都在
345000	348000	我们的战友在前线的辛苦和付出
348000	350000	小到正义小Sara
350000	352000	还刚刚回去的鲍尔代
352000	354000	从加拿大去的
354000	357000	到62岁的近东南
357000	360000	每壹个人的故事
360000	363000	和这个中国的现在是铁索女
363000	365000	索烈女也好
365000	368000	还有中共的现在支持的俄乌战争
368000	371000	还有整个中国小粉红
371000	374000	正在信高采烈的自己要大赢的时候
374000	376000	他们说自己已经进入了人类
376000	380000	中国人几千年来没有的最大的灾难
380000	383000	只有新中国联邦人在这个世界上
383000	386000	为中国人呐喊
386000	387000	告诉这个世界上
387000	388000	特别告诉中国人
388000	391000	世界的排华和印尼的排华
391000	394000	就在我们身边正在发生著
394000	398000	谎言、欺骗在中国管用
398000	403000	在全世界你肯定不会壹直管用
403000	409000	人类已经进入了前所未有的大变局
409000	412000	我昨天下午和壹个咱们合作的壹个公关公司
412000	415000	我告诉他
415000	416000	他在问我很多问题的时候
416000	419000	他说妳觉得世界妳的判断会是什么样的
419000	422000	我说就像我告诉妳壹样
422000	425000	人类走向壹个
425000	428000	真的是无皇有主的时代正时到来
428000	430000	什么叫无皇有主啊
430000	431000	没有皇帝
431000	437000	只有以民为主的天下正时到来
437000	440000	世界上不可能再看到未来的俄罗斯
440000	442000	不可能
442000	445000	也不会有今天的欧洲
445000	448000	妳会很快看到世界上
448000	453000	俄罗斯和欧洲被壹个大的欧洲整体所代替
453000	454000	它叫什么
454000	456000	过去叫Europe
456000	458000	Europe、欧洲
458000	460000	现在我告诉妳叫乌克兰州
460000	463000	叫Europe
463000	464000	没有俄罗斯
464000	466000	叫Eurus
466000	468000	不可能在俄罗斯存在
468000	472000	它就变化就会这么大
472000	474000	而且我说妳会看到中国
474000	477000	所谓的大中国不会存在
477000	480000	整个中国会被解体
480000	485000	所有的台湾、香港、新疆、西藏、广东
485000	489000	甚至东北都会被解体
489000	491000	然后会成为壹个叫什么
491000	495000	中华民国会成个叫做中华台湾国
495000	499000	西藏国、新疆国、广东国就越国
499000	503000	整个福建朝东都会划给台湾
503000	505000	而且不是外国势力的干涉
505000	510000	是中国人自愿的
510000	512000	然后妳会看到
512000	515000	在世界上就像我以前说的壹样
515000	518000	加拿大在美国过去这些年
518000	522000	大家都知道只是美国的裤裆里壹根毛而已
522000	526000	它会逐渐的立起来成为独立的壹个个体
526000	528000	大量的移民
528000	531000	澳大利亚会崛起
531000	535000	所以说大家会看到整个世界的变局
535000	541000	欧洲彻底板块没有什么东欧、中东欧、西欧不会的
541000	543000	会以乌克兰为主的这么壹个欧洲
543000	547000	它说那妳觉得乌克兰的经济妳靠什么支撑呢?
547000	549000	既没有什么英国、法国什么壹大堆
549000	551000	我说妳这太胡扯
551000	552000	人类的变天
552000	555000	帝国都在整个地球之间转移
555000	558000	何况妳是欧洲的中心了
558000	562000	乌克兰这次给人类奠定了基础
562000	565000	人类上缺乏的正义和勇气
565000	567000	乌克兰会以什么为中心?
567000	569000	我告诉大家
570000	571000	高科技
571000	574000	它会发展到新的能源中心
574000	576000	代替天然气和石油
576000	582000	以及未来的通信、网络、科技、太空
582000	586000	都会以乌克兰人和乌克兰为中心
586000	588000	建立欧洲的大中心
588000	592000	然后第二个经济妳靠什么?数字
592000	595000	数字经济、数字货币
595000	597000	还有壹个最重要的
597000	598000	叫数字安全
611000	613000	所以妳会看到这个世界上
613000	615000	新的未来妳会看到
615000	618000	小飞侠最感兴趣的UFO
618000	620000	还有小王子
620000	624000	妳记住UFO还有太空格局
624000	626000	包括无人机
626000	630000	以及妳们最想探索的
630000	632000	就是太空的所有的壹切幻想
632000	635000	可能都会在乌克兰这个地方为中心发生
635000	637000	因为全世界的年轻人
637000	640000	有良知的人都会聚在那里
640000	643000	为什么?那里的人勇敢
643000	645000	那里的人懂得感恩
645000	648000	而且那里的土地富饶
648000	649000	那里的交通条件
649000	653000	交通条件壹切从黑海、死海
653000	657000	到地中海到红海
657000	663000	都会成为那里的整个的最天然的条件
663000	666000	那整个亚洲呢?就是台湾
666000	667000	妳看岛小
667000	669000	台湾会把帛琉
669000	671000	整个周围那些小国家
671000	674000	甚至日本的北部
674000	676000	以及整个中国南海
677000	680000	以及广西那壹附近的
680000	684000	整个广东东漫部全划给中华民国
684000	686000	中华台湾国
686000	688000	妳会看到西藏新疆大解体
688000	690000	这是没有任何疑念的
690000	694000	普京的普京时代已经彻底过去了
694000	695000	七哥早就告诉妳们
695000	697000	他只要打响机壹枪就过去了
697000	699000	习的时代不是过去了
699000	703000	习的时代在I extremely pencil
703000	705000	就像纽约法官要说
705000	708000	我会让Miles过I extremely pencil
708000	710000	再让我I extremely pencil
710000	713000	像是这蔡伟健这个流氓
713000	715000	要让Miles过I extremely pencil壹样
715000	720000	习会在I extremely pencil当中壹直到他过去
720000	722000	然后中国人会很多人
722000	726000	跟他I extremely pencil到坟墓里
726000	728000	妳会看到天安门上
728000	730000	不会有壹点共产党的标志在那里
730000	732000	而且是壹夜之间
732000	734000	我说壹夜都很长了
734000	735000	壹夜都很长
735000	737000	也就是妳们双休两次的时间
737000	738000	我说壹夜
738000	740000	因为咱们新中华台湾人的壹夜
740000	742000	都是干好多事
742000	744000	世界就是这样的
744000	747000	妳知道现在咱们的这个
747000	751000	大家看到的喜币现在40块5
751000	753000	接下来两周
753000	754000	我今天再说壹个
754000	758000	两周妳看那喜币会有什么消息
758000	759000	很有啊
759000	761000	妳别大家壹猜就是上天上月亮了
761000	762000	妳们别这么猜
762000	764000	特别继续啊王维廉
764000	765000	妳别乱解啊
765000	766000	妳得搂住
766000	770000	会有壹个妳想到壹个小的制度的改变
770000	778000	5周以内到6周妳会看到壹个惊天的消息
778000	780000	然后妳会看到
780000	782000	今天兄弟我再告诉妳们
782000	784000	今天我再给妳们重申壹遍
784000	788000	3月底到4月15号
788000	795000	是共产党在世界上开始疯狂的开始
797000	799000	它的疯狂在哪里
799000	800000	妳们知道吗
800000	801000	壹会儿妳们可以问我
801000	803000	提醒我别让我忘了
803000	805000	我像今天跟妳们说到这儿
805000	807000	额无战争意义著什么
807000	811000	让我们现在首先大家壹起开始追求小王子
811000	814000	为我们战友在前线的所有战友
814000	816000	在风雪中的战友
816000	818000	还有像文葛七雄
818000	823000	还有我们的蚂蚁兄弟陪伴著这90多个孩子
823000	825000	已经送到了西班牙
825000	827000	在这场救援当中
827000	831000	最最冷漠的文科意大利
831000	833000	还有我们西班牙的文葛七雄
833000	836000	做出了绝对的突出的
836000	839000	老黄牛精神的默默的贡献
839000	841000	还有很多战友我们前线的
841000	845000	英喜的、杨帆的、我们的美东的
845000	846000	就不用提了
846000	849000	还有美国西部小李全球的战友
849000	851000	走到前线为他们先祈福
851000	853000	祈完福我们再开始今天的直播
853000	854000	谢谢
871000	876000	所有的儿童、母亲和那些英雄们
876000	878000	为他们祈福平安和平
878000	880000	阿弥陀佛
883000	885000	好 开始
885000	887000	这不是长期的
887000	888000	现在开始吧
888000	889000	好的
889000	892000	那我们就先谈我们今天这个第一个话题
892000	893000	就是聚焦这个俄物战争
893000	894000	我们有壹个PPT
894000	897000	这是中共专门揭露这个中共网络信息
897000	899000	超限战犯下的反人类罪
899000	901000	我们先有请我们的这个PPT
930000	935000	该邮箱和服务器是法治基金义工小王子个人付费书册
935000	937000	小王子提供了很多文件
937000	938000	并视频验证
938000	939000	申请恢复
939000	940000	但仍被拒绝
940000	941000	3月8日
941000	944000	新中国联邦及时公布了新的救援邮箱
944000	946000	万幸邮件有备份
946000	949000	目前救援工作仍正常进行
949000	952000	中共委内特务恶意拨打救援电话
952000	953000	造成信息堵塞
953000	956000	污蔑新中国联邦人道主义救援行动
956000	958000	散布虚假信息
958000	959000	中国被困同胞
959000	962000	导致已经登上救援车辆的18名中国人下车
962000	964000	至今生死不明
964000	965000	同时
965000	966000	Facebook
966000	967000	Telegram
967000	968000	Twitter
968000	969000	也屏蔽了救援信息
969000	970000	要知道
970000	972000	准确及时的信息传递
972000	975000	关乎到每壹个待救者的生命
976000	980000	中共对爆料革命的打击从未停止
980000	982000	2017年4月19日
982000	983000	VOA断播
983000	987000	标志著中共对郭先生和爆料革命网络攻击的开始
987000	988000	4月26日
988000	991000	推特首次冻结郭先生账号
991000	993000	4月29日
993000	996000	GBC对郭先生的采访未能播出
996000	997000	2017年7月
997000	1000000	ClockHill律所的500台电脑被黑客
1000000	1002000	中共窃取所有客户资料
1002000	1004000	借此威胁该律所
1004000	1007000	不准受敌郭先生正逼的请求
1007000	1008000	7月29日
1008000	1011000	ADM的传控雷达遭中共黑客控制
1011000	1013000	差点酿成惨祸
1013000	1014000	9月
1014000	1018000	Facebook限制了郭先生中文账户的发布功能
1018000	1019000	10月3日
1019000	1020000	受中共胁迫
1020000	1024000	哈德逊研究所取消了郭先生的预定演讲
1024000	1026000	2017年10月18日
1026000	1029000	推特关闭了郭先生账号
1029000	1030000	10月
1030000	1033000	YouTube限制了郭先生账号的直播功能
1033000	1035000	2019年7月13日
1035000	1037000	法治基金直播被黑中断
1037000	1039000	郭媚点无法使用
1039000	1041000	2020年5月19日
1041000	1044000	中共窃取GTV服务器密码
1044000	1045000	安装病毒软件
1045000	1047000	原成控制数据
1047000	1049000	2021年3月31日
1049000	1053000	GTV遭到中共网络黑客攻击而瘫痪
1053000	1054000	7月4日
1054000	1056000	Gator遭中共疯狂攻击
1056000	1058000	很多大V的账户被黑
1058000	1060000	用户名被篡改
1060000	1062000	2022年3月3日
1062000	1068000	GTV被中共黑客篡改大量数据被迫关闭
1068000	1070000	中共犯下反人类罪
1070000	1072000	国际上反人类罪的定义是
1072000	1075000	国家或体体对一般国民犯下的
1075000	1078000	以谋杀灭绝为目的的大规模杀人
1078000	1079000	独立化
1079000	1080000	驱逐
1080000	1081000	等非人道行为
1081000	1084000	中共封锁人道主义救援信息
1084000	1085000	等同于谋杀
1085000	1087000	如此和抹黑爆料革命
1087000	1090000	传递病毒疫苗真相相当于灭绝人类
1090000	1094000	新疆集中营对维吾尔族进行种族灭绝
1094000	1098000	香港屠城数万年轻人被强奸
1098000	1101000	被酷刑被失踪被谋杀
1101000	1105000	徐州锁链女被困强奸20年
1105000	1108000	在中国类似锁链女不弃起诉
1108000	1114000	中共的网络和媒体正与俄罗斯军队一起攻击乌克兰
1114000	1120000	但是新中国联邦一定会将邪恶的中共和独裁者们
1120000	1124000	送上纽伦堡国际军事法庭接受正义的审判
1124000	1126000	感谢您的观看
1126000	1129000	感谢雅典娜、纽伦堡七七成功农场
1156000	1158000	用蓝金黄的力量
1158000	1162000	共产党把我们所有救援邮箱整个给关掉的这个事情
1162000	1165000	那么事情的经过大概是这样的
1165000	1167000	就是像七哥说的一模一样
1167000	1169000	就是说所有共产党用的一切
1169000	1173000	就是用所谓合理的理由来卡住你所做的所有的一切
1173000	1177000	这七哥已经这几年关掉几千个几百个邮箱
1177000	1180000	多少个账户这都已经完全毫不夸张的说
1180000	1182000	那么现在所有七哥经历的一切
1182000	1184000	战友们都一个一个都去经历
1184000	1188000	然后我相信世界上所有的正义的组织都会去经历这些
1188000	1191000	那么三四天前他大概说的是什么情况呢
1191000	1194000	说怀疑我的信用卡被我倒刷了
1194000	1197000	就怀疑小王子倒刷了小王子的信用卡
1197000	1199000	那么我要证明小王子就是小王子
1199000	1201000	小王子的信用卡就是小王子的信用卡
1201000	1206000	然后我给他提供了一切的及时所有他需要的一切的资料
1206000	1208000	结果就是提交资料
1208000	1209000	收到啊没收到
1209000	1210000	收到啊没收到
1210000	1212000	然后客服一会说一个小时恢复
1212000	1214000	一个小时恢复一会说至少一个小时恢复
1214000	1215000	一会说恢复不了
1215000	1218000	整个的就是共产党的假骗偷
1218000	1220000	完全利用欺诈的手段
1220000	1222000	利用所有的这个蓝金黄的力量
1222000	1228000	关掉了我们所有整个乌克兰在前线救援使用的两个官方邮箱
1228000	1231000	而且我多次告诉他们我说我是法治基金的义工
1231000	1234000	我有法治基金的授权购买这些邮箱
1234000	1238000	送给法治基金作为我们整个前线救援的所有的整个最第一线的
1238000	1241000	就是你在火灾中你心脏病爆发了
1241000	1244000	你打911结果911电话服务商把911给停下来了
1244000	1247000	这就是一个反人类罪战争罪
1247000	1250000	这就是共产党对我们整个乌克兰的救援行动
1250000	1252000	对他打脸恐怖最好的体现
1252000	1254000	好话不多说谢谢齐哥
1256000	1258000	谢谢小王子
1258000	1262000	那我想听听我们在这里的嘉宾的一些对这个事情的看法
1262000	1264000	或者问题Tex
1266000	1268000	对当时因为我们也在后台一直工作
1268000	1272000	我们前一天还在积极的就是忙著把那些很多
1272000	1275000	schedule啊什么那些就忙著给人家发
1275000	1278000	然后就是在整合的当中第二天突然就听说
1278000	1280000	哇我们的邮箱当掉了
1280000	1283000	我当时都傻眼了我以为只是说我们的outlook那边当掉
1283000	1287000	谁知哇他直接就把我们整个邮名给掐掉了
1287000	1290000	那邮名你知道如果背后的邮箱被黑了还好
1290000	1292000	因为邮名我们还可以转接
1292000	1294000	但是邮名掐掉了以后我们完全就是失联了
1294000	1296000	好像我们的电话还能用
1296000	1299000	所以当时我们就做出了一系列紧急的处理
1299000	1302000	然后小王子也是那天在那边真的是五个小时
1302000	1306000	从我们一开始听到说邮箱掐断了他就一直在打电话
1306000	1309000	打到最后我们得到确切的消息GoDaddy
1309000	1315000	然后那个小王子还写了一封非常劲爆的那个最后一封信给他们
1315000	1318000	就是对我发现小王子真的很有guts啊
1318000	1321000	就是写得特别好我觉得特别爽看起来
1321000	1324000	但是也看到共产党的套路就那些
1324000	1327000	而且永远走来走去我们发现哪里都有共产党的影子
1327000	1330000	而且他们做事那个方法很像
1330000	1332000	就无论你银行封账号还是什么
1332000	1334000	这些封账号一模一样的感觉
1334000	1338000	就是同一个口味不同的包装谢谢
1340000	1342000	有请唐萍
1343000	1347000	我觉得CCP他们的就是low招
1347000	1350000	而且就是特别恶心的
1350000	1355000	像这种风油箱这种事情简直就是在谋杀
1355000	1359000	包括就联系到我自己
1359000	1362000	我们家有两次著火
1362000	1366000	然后后来还有各种的
1366000	1371000	我就觉得他们的这种行为让我更有勇气
1371000	1375000	说要站出来跟他们干的
1375000	1377000	是的
1377000	1380000	全是这种下三滥的手段
1380000	1382000	包括大外宣
1382000	1384000	造谣造郭先生的谣
1384000	1387000	造我们这个霸道革命的谣
1390000	1393000	是的这个共产党从古到现在
1393000	1395000	一直就是这样
1395000	1398000	从抗战人质国民党在打在抵抗日军
1398000	1400000	共产党在后路中压线然后各种捣乱
1400000	1403000	到现在我们在救人共产党也是各种捣乱各种破坏
1403000	1405000	他的招从来就没变过
1405000	1407000	因为他就只会这些招
1407000	1409000	所以说他做的这些事情
1409000	1412000	更能让所有全世界都能看清楚
1412000	1416000	谁才是在救人谁是在阻碍救人
1416000	1420000	然后让全世界都有个对比
1420000	1425000	我们新中国联邦才是能够代表所有的华人
1425000	1427000	所有的中国人的力量
1427000	1429000	共产党不能代表中国人
1429000	1432000	这样才能把共产党跟中国人民去分开
1432000	1434000	我觉得是一个密宗胜远的好事情
1436000	1437000	谢谢
1439000	1441000	谢谢Rachel小王子Tax
1441000	1444000	长平老师和薇蕾王老师的分享
1444000	1446000	那我这边作为一个客服
1446000	1450000	因为当时我们跟小王子一起也经历了这个事情
1450000	1452000	小王子漏掉了一个很关键的细节
1452000	1454000	就是当他在跟客服打电话的时候
1454000	1456000	最后夸张到一个程度
1456000	1458000	就是小王子只要报他自己的名字
1458000	1460000	客服就直接把他电话给掐了
1461000	1465000	就是这个是非常非常夸张的一个事情
1465000	1468000	那但是我们其实在邮箱被黑之前
1468000	1471000	Tax这边就已经准备了一些备用的邮箱
1471000	1475000	包括我们是一直都有备用的通讯的方式跟电话的
1475000	1477000	只是我们没有对外公开
1477000	1478000	我们一个是怕战线
1478000	1481000	第二个也是怕有紧急情况的发生
1481000	1485000	在共产党把我们的这些整个邮箱跟域名拿掉之前
1485000	1489000	我们的一些备用方式就已经被他们检测到
1489000	1491000	然后有些就是打了四个电话
1491000	1493000	然后整个账户就停了
1493000	1497000	所以其实我们背后已经经历过这个事情了
1497000	1501000	那当然我觉得因为这个事情郭先生也全程都知道
1501000	1504000	我们想说的就是说下一次我们在经历这个事情
1504000	1506000	不会再给共产党12个小时
1506000	1509000	或者是半天的这样的时间去反应
1509000	1511000	我们会准备更多的方案
1511000	1512000	就像郭先生说的
1512000	1513000	下一次如果发生这个事情
1513000	1516000	我们应该半个小时20分钟甚至10分钟
1516000	1518000	我们就可以对外去公告新的方式
1518000	1521000	永远要确保我们在救援的过程当中
1521000	1523000	不会让共产党去得证
1523000	1525000	把我们的这种通信给切断
1530000	1532000	这事儿我就想说这个行为
1532000	1534000	共产党的行为就是谋杀
1534000	1536000	而且是集体大规模的谋杀
1536000	1538000	在全世界面前
1538000	1540000	在全世界盯著我们
1540000	1542000	在看我们救援的这个同时
1542000	1544000	共产党做出了这种行为
1544000	1545000	而且漏到什么情况
1545000	1547000	就是我们当时正好我在线
1547000	1550000	然后跟几个义工一起在这个看著这个邮箱
