start	end	text
1550000	1553000	突然间所有义工的邮箱同时登出
1553000	1555000	然后网站在同一时间被黑
1555000	1557000	就是一下就消失掉了
1557000	1560000	所以这是不可能是说一个巧合
1560000	1562000	这绝对是一种黑客的行为
1562000	1564000	然后最后就是到小王子这边联系
1564000	1567000	一开始说一个小时内能解决
1567000	1569000	然后又推成一个小时
1569000	1571000	至少一个小时解决
1571000	1572000	然后又要几个小时
1572000	1573000	然后又要一天
1573000	1574000	然后又要一天
1574000	1576000	就跟封咱们战友推特似的
1576000	1578000	就是给你来一个缓著落
1578000	1580000	然后让你一直有期待
1580000	1581000	但是不给你结果
1581000	1582000	但是这个事情
1582000	1584000	这一次这个事情真的是非常严重
1584000	1586000	我们因为通过邮箱
1586000	1589000	救助的这些人是最多的
1589000	1592000	而且所有人基本上都是通过邮箱和我们联系
1592000	1594000	这一次真的共产党让世界都看到了
1594000	1596000	他的这种所作所为
1596000	1597000	谢谢
1597000	1599000	谢谢小飞翔小飞翔
1599000	1601000	那我就很简单的说一下
1601000	1605000	我觉得这个就是让世界的人看到了中共的蓝金黄
1605000	1607000	我觉得在这一场就是怎么讲
1607000	1608000	后台的这个战争
1608000	1609000	包括email
1609000	1611000	包括小飞翔小飞翔克服的这一块
1611000	1612000	他的反应
1612000	1613000	包括我们跟七哥学习的
1613000	1616000	因为中共的行为是非常有预见性的
1616000	1617000	它是一定会破坏的
1617000	1619000	七哥在之前就已经提醒了
1619000	1621000	然后我们的战友其实已经都准备好了
1621000	1622000	包括的backup
1622000	1624000	只是我们时间上晚了一点
1624000	1626000	但是这个我们是可以学习的
1626000	1628000	我相信刚才小飞翔小飞翔说得非常好
1628000	1630000	但是之前还有一个事情就是text now
1630000	1634000	通过这件text now跟go daddy的对比
1634000	1641000	我们就知道哪些西方的公司是可以支持我们正义力量的
1641000	1644000	哪些西方的公司是邪恶的被蓝金黄渗透的
1644000	1645000	所以这又分开了
1645000	1647000	所以这让我们擦亮了眼睛
1647000	1650000	看清楚哪些是可以跟我们一起灭共的
1650000	1651000	一起前行的这些人
1651000	1653000	所以说我觉得这是件好事情
1653000	1655000	而且因为我们的这件事情
1655000	1657000	全世界都在关注乌克兰
1657000	1659000	其实中共自己就挖了又一个坑
1659000	1662000	所以说又给我们新中国联邦做了电梯往上升
1662000	1665000	所以说任何的这个他们出了漏糟
1665000	1667000	都是我们的这个返回去的子弹
1667000	1668000	所以我也很兴奋
1668000	1670000	我觉得我们团队历练了
1670000	1671000	而且这件事情有好变坏
1671000	1673000	交还给七哥您
1675000	1676000	兄弟姐妹们
1676000	1679000	就是你们每个人讲的都特别特别的好
1679000	1680000	特别特别对
1680000	1683000	我想给大家分享几个信息
1683000	1686000	我们所有参与爆料革命的战友
1686000	1688000	你们想过过去这五年
1688000	1691000	七哥能保持每天都和你们保持联系
1691000	1692000	还能出镜
1693000	1696000	从这件事你们看七哥有多难
1697000	1699000	你看看当年HBO采访我的时候
1699000	1701000	这帮孙子我展示给他
1701000	1705000	我有88个电话被黑客
1705000	1707000	当场看著骂我
1707000	1710000	什么大叔叫叩死你共产党的软件
1710000	1712000	打死你骂的那种粗鲁
1713000	1714000	那种骂
1715000	1716000	电脑
1716000	1720000	制造我和王彦平的上床的假音频
1722000	1724000	你听听我这声音是像那个喘气的吗
1724000	1726000	现在我有歌声会呼麦了都
1726000	1729000	唐明威在往后我练的
1729000	1731000	嗓音进入无遗
1731000	1734000	人家有视网膜也有阴膜你知道吗
1734000	1738000	你听的那声音是不是我跟王彦平跳床的声音
1739000	1740000	就是共产党
1740000	1744000	你想想这五年你七哥就保持直播
1744000	1746000	大家壹直爆料革命
1746000	1748000	不要说419
1748000	1753000	背后的各种故事那个难度你去想吧
1753000	1755000	船的失控
1755000	1760000	飞机你知道我们多少次飞机出多少问题知道吗
1760000	1762000	你说我每次上飞机的时候
1762000	1764000	我就知道共产党盯著这飞机
1764000	1767000	所以我这辈子都想再坐私人飞机
1767000	1768000	在共产党不灭之前
1768000	1770000	为了共产党坐私人飞机
1770000	1773000	因为私人飞机就是最具体的目标
1773000	1775000	我也没钱买了
1775000	1778000	等我把这破产过了再有钱的时候
1778000	1780000	我再买就买五个壹起取飞
1780000	1785000	我在这中间还能串的在共产党变化之前还可以
1785000	1788000	我不跟妳们开玩笑这很吓人啊
1788000	1791000	然后妳们看到当时我从来不用疫苗
1791000	1794000	跟著我的人就倒了没了
1794000	1797000	妳知道那些美国人他根本没脑子
1797000	1800000	就干壹份工作突然疫苗被黑了
1800000	1805000	妳知道我们很多美国真的是人家吓到什么程度
1805000	1813000	老婆女儿爹妈40年爹妈供房子的账号全给妳关掉
1813000	1817000	这在美国无数起就在这小王子
1817000	1821000	你问问旁边的咱的老同事他们哪家没被关过账号
1821000	1825000	都是美国人哪家没关过这个信用卡
1825000	1827000	房贷车贷都给关掉
1827000	1831000	战友们妳们没有看到爆料革命的艰难和付出
1831000	1835000	妳们放到妳们身上壹毛就把妳砸的歪歪了
1837000	1840000	整个全世界同性恋妳想过壹个问题吗
1840000	1844000	鸡哥的推特壹超过50万停下来了
1844000	1849000	42万43万42万从来不上去最后给妳关掉
1849000	1854000	我的YouTube就是在45万期就永远达到42万
1854000	1858000	已经三年了42.3万就壹个都没涨过
1860000	1863000	妳们谁想过7个的委屈啊
1863000	1868000	妳想过GTV壹年上线3月14.4万
1868000	1874000	14.43万8个月壹个没涨妳相信吗
1874000	1876000	这数据GTV
1877000	1880000	能改GTV数据的是谁啊
1881000	1882000	那可不是共产党
1882000	1887000	那是世界上所有的背后的控制数据的中心中的中心
1889000	1893000	妳能相信现在盖特可以公开大家说被黑掉
1893000	1898000	5800万到8000万之间的有效登记的客户
1898000	1900000	妳吓不吓死人
1901000	1905000	现在我们的工程师自己就知道300万到500万
1905000	1908000	妳说吓不吓死人
1908000	1910000	黑到什么程度
1911000	1914000	妳知道咱们从GTV开始到现在
1914000	1917000	像这个SEC的这种流氓假投诉
1917000	1919000	从过去5年到今年多少起吗
1919000	1920000	大家数数
1920000	1925000	谁受得了上万起的虚假诉讼报案假投资
1925000	1929000	那眉毛的痘痘还有那壹帮烂孙子
1929000	1930000	他们有底线吗
1930000	1932000	他是为了我骗他吗
1932000	1934000	那我们去乌克兰救援会骗他吗
1934000	1936000	涉及到个人的利益吗
1937000	1939000	郭三秒跟这有关系吗
1939000	1941000	我三秒跟乌克兰救人有什么关系啊
1941000	1944000	我郭强奸我强奸别人了
1944000	1946000	跟这个乌克兰救人有什么关系呢
1946000	1948000	再一个上前线的那些人
1948000	1951000	跟郭三秒有什么关系呢
1951000	1953000	跟我强奸谁有什么关系呢
1953000	1955000	小王子的勾呆力
1955000	1958000	跟郭三秒郭强奸有什么关系呢
1960000	1962000	咱们有战友发出乌克兰救援
1962000	1964000	竟然有人在下面写壹句话
1964000	1966000	我从来不在乎五毛人
1966000	1968000	但我看到壹个竟然说了什么
1968000	1972000	你们这帮人真是无耻至极无语了
1972000	1974000	就这个世界上共产党
1974000	1978000	能把捷索女说成在中国普遍现象
1978000	1981000	现在要想办法说从大秦朝到现在都是存在的
1981000	1984000	不是共产党壹天的事
1984000	1986000	要退给大秦朝去
1987000	1990000	俄罗斯打乌克兰竟然编造谎言
1990000	1993000	有咱们老椅子战友啊多个给我发信息
1993000	1995000	说因为乌克兰有三个核电站
1996000	1997000	核武击库
1998000	2000000	俄罗斯是维护人类的正义才打乌克兰
2000000	2002000	拯救全人类
2004000	2006000	就这种谎言我真的不如说
2006000	2008000	小王子长了两生子气
2010000	2011000	前后轮著用
2011000	2012000	我这样说你都信了
2012000	2014000	你这种智商
2014000	2016000	小王子你现在脱了裤子
2016000	2018000	大家看壹看你是不是有两生子气
2019000	2021000	有黑森林有黄森林是吧
2021000	2022000	我相信只有这样
2022000	2024000	大家没有这种智商人性了
2024000	2027000	你就是真的以全家都会遭受诅咒的
2028000	2030000	就像高冰城这种孙子
2030000	2035000	他女儿他老婆一定会遭受比锁链女还惨的在意
2035000	2036000	因为他害人呐
2038000	2040000	路大脑在石腰岩和九指腰这种烂人
2040000	2043000	九指腰这辈子壹个女人给剁掉壹个指子
2043000	2044000	这就是惩罚
2044000	2048000	上天壹定让他的儿子让他全家人遭受万万辈的诅咒
2048000	2052000	他在阻止救人
2052000	2053000	这不是谋杀
2053000	2054000	这是屠杀
2057000	2060000	小飞翔你给他听听真够客气的你啊
2060000	2061000	你给他听听谋杀
2061000	2063000	谋杀是谋杀几个
2063000	2064000	这叫屠杀
2066000	2067000	人家前线救人的
2067000	2069000	在前线人家扫壹下马就进来
2069000	2070000	扫马没了
2070000	2071000	把我们地位骗了
2071000	2073000	然后就失望了
2073000	2075000	在战争中对别人的失望
2075000	2077000	不是壹个道德问题
2077000	2079000	是生死的问题
2081000	2083000	妳根本没办法评估
2083000	2085000	或到法院的法官告诉妳说妳告诉我
2085000	2087000	到底妳影响多少救人啊
2087000	2089000	妳能妳能算出来吗
2089000	2090000	世界上没有这个方式
2091000	2093000	死的人再也不会说话
2094000	2097000	那妳们还想过爆料革命能走到今天
2097000	2099000	是这个媒体多重要吗
2099000	2101000	没有媒体咱今天能干啥
2103000	2105000	妳们谁想过兄弟姐妹们
2105000	2106000	妳们兄弟姐妹们
2106000	2108000	我们唱的歌是歌吗
2108000	2110000	那是呐喊
2110000	2112000	是呼吁
2112000	2114000	是在到处救人
2114000	2116000	如果说今天我们爆料革命是壹个部队
2116000	2118000	在拯救人类的话
2118000	2121000	那个歌声就是我们的大广播大喇叭
2122000	2124000	就是我们的探照灯
2124000	2126000	在告诉人我们来救妳了
2127000	2129000	但是共产党呢
2129000	2132000	却把这个灯给妳打灭
2132000	2134000	黑暗中的那盏
2134000	2138000	照亮黑暗的那盏智慧之灯要给妳灭掉
2138000	2140000	要把妳的声音全部给妳
2140000	2142000	所有关掉这个喇叭
2142000	2145000	不要任何壹需要救人听到妳的声音
2145000	2149000	同时我前天我告诉唐平木兰
2149000	2152000	我说我们在三月八号献给三八节
2152000	2155000	这个礼物上场的盖特和YouTube上去吧
2155000	2158000	我说完话我对著手机说完
2158000	2160000	30分钟YouTube就给我发了个信息
2160000	2162000	妳的频道
2162000	2165000	由于违反社区规则停止7天上传
2165000	2167000	我说木兰咋不是啊木兰
2167000	2169000	叫木兰过了几分钟
2169000	2171000	这时候唐平妹妹在给传那个歌
2171000	2175000	就中间我说就不到30分钟唐平妹妹在这呢
2175000	2177000	结果木兰给我回去
2177000	2178000	七哥我去看看
2178000	2184000	找出我2020年说的有个视频讲到了病毒
2184000	2187000	妳看看马上给妳捋到2020年
2187000	2189000	我这个手机现在
2189000	2192000	我知道这些狗日子都在看著我手机听著们
2192000	2195000	郭文贵要是放不拿手机就不是人
2195000	2197000	我跟妳全玩明的
2197000	2199000	郭文贵妳有壹个敢的吗
2199000	2200000	我就带著手机
2200000	2202000	妳现在听著我都知道
2202000	2205000	而且这帮王八蛋妳们这帮被共产党作恶的人
2205000	2207000	都在镜头前面呢
2207000	2212000	30分钟YouTube就开始传不让我上传这个歌
2212000	2216000	接下来马上就在同壹时间
2216000	2218000	这时间不到40分钟
2218000	2219000	狗仔里干掉
2222000	2224000	不到将近不到两小时
2224000	2229000	我的手臂我四个手机两手机完全打不开
2229000	2232000	就在我旁边的电脑都打不开
2232000	2237000	而且我要跟Wi-Fi开会的时候结果是视频没有
2237000	2240000	大家记住只要妳用了Wi-Fi
2240000	2242000	只要妳用了这个蓝牙
2242000	2243000	它就会找到妳
2243000	2244000	它就会控制妳
2244000	2246000	我这是2017年说的不是今天说的
2249000	2252000	最可怕的事情就是在美利坚共和国
2252000	2254000	还有在其他国家
2254000	2257000	共产党的黑暗势力是全球的妳们想过吗
2260000	2262000	我们上传的歌曲
2262000	2264000	木兰去上传完以后人家问他
2264000	2267000	妳这个照片模糊啊
2267000	2270000	妳这个风月模糊啊
2271000	2273000	他们找我麻烦呢
2273000	2275000	跟唐明他俩
2275000	2277000	哎呦我跟他们
2277000	2278000	他们找我麻烦呢
2278000	2281000	跟唐明两个人就是两个这样的女孩
2281000	2284000	他只是发出壹个女人的正义的声音
2284000	2285000	多么的弱小
2287000	2291000	妳共产党用壹国之重器妳来打牙
2294000	2295000	我们GTV
2295000	2301000	妳谁想过咱们14万4千3的数据8个月壹个没增加
2305000	2306000	我的Instagram
2306000	2307000	三个Instagram帐号
2307000	2309000	上去以后就3万多8万多
2309000	2311000	然后直接上20万的关注量
2311000	2313000	壹个小时就回到3万了
2313000	2314000	再不涨了
2314000	2316000	然后我的Instagram帐号再找不回来了
2317000	2319000	只要我郭文贵任何的地方
2319000	2321000	我只要登Facebook
2321000	2323000	我用任何人电脑
2323000	2324000	我上唐明家
2324000	2326000	我拿他电脑去注册
2326000	2327000	只要我上去注册
2327000	2328000	他就把我关掉
2328000	2330000	我用微联网也把我关掉
2331000	2333000	Facebook这种辨别能力
2333000	2335000	机器的辨别能力有多强
2337000	2339000	就Facebook就这么黑
2339000	2341000	然后在谷歌上
2341000	2342000	妳看看啊
2342000	2344000	大家看著在谷歌上
2344000	2347000	七哥的个人信息曾经达到多少呢
2347000	2349000	600亿次的搜索
2349000	2351000	壹页时间归零
2351000	2353000	又到通波600亿
2353000	2354000	又壹页时间归零
2354000	2356000	大家就查查去
2356000	2357000	我从来不说这事
2357000	2360000	我说大家都比我聪明会看
2360000	2362000	为什么今天说
2362000	2365000	我要是在这个乌格兰战争之前说
2365000	2366000	妳小王子
2366000	2367000	妳Rachel
2367000	2368000	妳Tex
2368000	2369000	妳们所有的人
2369000	2370000	小飞象
2370000	2371000	小飞侠
2371000	2372000	妳没感受它
2372000	2374000	这就像我现在在屏幕给妳们说
2374000	2375000	搞双修壹样
2375000	2376000	流水流水
2376000	2378000	反正大家也赶不著热度就说呗
2378000	2380000	这要摸到妳屁股的时候
2380000	2382000	就嗷著就叫唤了是吧
2382000	2384000	现在就该轮到真摸到妳屁股了
2387000	2388000	这是大屠杀
2389000	2391000	妳看看我们在前线的战友
2391000	2393000	现在咱们在前线救援的战友们
2394000	2396000	中国历史上
2396000	2397000	在我可记忆的
2397000	2399000	我不知道有妳们记不记得
2399000	2402000	是黄皮肤人救白人第壹次
2402000	2404000	无力无权无求
2404000	2406000	我们是没有任何权力的组织啊
2407000	2409000	在我的记忆当中
2409000	2413000	中国人第壹次在世界上走在最前面救人
2415000	2417000	妳不知道这些人
2417000	2418000	我真的是我每天我真的
2418000	2420000	刚才我在直播前妳介绍说
2420000	2423000	妳如果妳每天不减少半小时
2423000	2425000	使用手机的时间的话
2425000	2427000	文贵妳真的会把妳毁掉
2427000	2429000	看我现在我每天看著妳
2429000	2432000	妳20个小时18个小时在用手机
2433000	2434000	太多时间
2435000	2436000	太多时间这妳去了干什么
2436000	2437000	我说妳还不高兴
2437000	2441000	刚才妳介绍了给我这煮了咖啡说的话
2441000	2444000	太多人找我全世界说
2444000	2447000	我们从来不知道中国人还会干这事
2449000	2452000	昨天晚上壹个英国的前首相说
2452000	2456000	Miles妳做了壹个很了不起的工作
2457000	2459000	这是个很好的想法
2460000	2462000	妳说我我真拿了闷了
2462000	2466000	我认识20 20年了妳觉得我做这事不是我们的本色吗
2466000	2468000	不他们的脑子里面根深蒂固
2469000	2470000	懦弱的中国人
2470000	2472000	自私的中国人冷漠的中国人
2476000	2479000	大家去想想我们救人家孩子的时候
2479000	2480000	哎我这不能说
2480000	2482000	得说这控制不住情绪
2482000	2485000	小王子妳讲讲这91个孩子吧
2485000	2487000	妳别落下任何人啊
2487000	2488000	这说不下去了
2489000	2493000	7哥那个正好我们刚刚接到信息
2493000	2496000	我们的文科兄弟在最前线最壹线
2496000	2497000	美迪卡文科兄弟
2497000	2499000	我们现在有他们的现场的画面连线
2499000	2500000	已经接近了
2500000	2502000	在美迪卡关口
2502000	2503000	快快快
2503000	2504000	快
2504000	2506000	我们大家都要亲吻文科兄弟啊
2506000	2509000	文科兄弟文哥啊
2509000	2510000	啊文科
2511000	2513000	哎呦终于找到了大卫
2513000	2514000	哎呀
2518000	2520000	我跟你说唯壹结学组成员
2520000	2522000	大卫兄弟在前线啊
2522000	2523000	大卫兄弟真的辛苦了
2523000	2525000	真的辛苦了啊
2525000	2528000	然后正义小莎莎是代表著年轻的豹二代
2528000	2530000	我的天呐爱妳们
2530000	2533000	哎呀文科兄弟是老黄牛
2533000	2535000	妳们仨先说说赶快赶快
2535000	2536000	妳们仨先说说
2536000	2537000	那边妳们先说
2537000	2538000	大卫兄弟妳们开始
2538000	2543000	没声音兄弟没声音
2543000	2546000	没声音没声音
2548000	2549000	还没有
2549000	2551000	没开麦
2551000	2553000	没开麦
2553000	2555000	现在好了现在好了
2555000	2557000	好好非常感谢
2557000	2558000	齐哥好大家好
2558000	2560000	所有成就的战友好
2560000	2562000	我们现在在这个边境口岸
2562000	2565000	所有的这个最接近乌克兰的位置
2565000	2566000	那么我们今天
2566000	2568000	我们新中国联邦我们法治基金
2568000	2570000	到达了这个
2570000	2573000	咱们这个Magica这个难民安法案
2573000	2575000	给他们送一些物资
2575000	2577000	我们现在这几天
2577000	2579000	现在外面的温度特别的冷
2579000	2581000	大概在零度左右
2581000	2583000	外面现在还飘著小雪
2583000	2585000	那么我们的战友非常的热情
2585000	2587000	而且我们到达这里之后
2587000	2590000	当地的这些组织
2590000	2592000	他们没有像我们这样子的
2592000	2594000	投入吧
2594000	2596000	因为我们你看我们现在正在
2596000	2598000	搭建一个一个
2598000	2600000	在这里来说是
2600000	2602000	最豪华的一个
2602000	2604000	最大姐姐的帐篷
2606000	2608000	他们自己这边的组织方
2608000	2609000	跟我们说
2609000	2611000	他们现在联系红十字协会
2611000	2613000	他们都没有办法给他们提供帐篷
2613000	2616000	因为可能是一个资源紧张
2616000	2618000	第二个是金问题
2618000	2620000	但是我们听说过联邦有这个实力
2620000	2622000	能够在第一时间到达现场
2622000	2624000	能够在第一时间去帮助
2624000	2626000	需要我们帮助的人
2626000	2628000	包括我们的华人
2628000	2630000	包括我们的美国
2630000	2632000	美国的朋友
2632000	2634000	以及我们昨天救了几个
2634000	2636000	我们意大利的朋友
2636000	2638000	我们有五个意大利朋友
2638000	2640000	昨天从乌克兰的前线的镇上
2640000	2642000	救出来了
2642000	2644000	然后还有我们的这些
2644000	2646000	乌克兰人的妇女小孩
2646000	2648000	我们前几天救出来
2648000	2650000	有九十多个乌克兰的小孩
2652000	2654000	我们都是在第一线
2654000	2656000	前线去无私的免费的
2656000	2658000	去帮助这些人
2658000	2660000	我们现在是在拯救世界
2660000	2662000	我们是因为和平
2662000	2664000	我们全部都是为了
2664000	2666000	这些受难的同胞
2666000	2668000	算是
2668000	2670000	所以说我们非常感谢
2670000	2672000	法治基因
2672000	2674000	我们新中国联邦非常感谢
2674000	2676000	法治基因提供了这些所有的物资
2676000	2678000	包括我们前线的这些武装
2678000	2680000	都是有法治基因给我们提供的
2680000	2682000	非常的感谢
2684000	2686000	谢谢
2690000	2692000	其实文哥兄弟他们是
2692000	2694000	五位战友三男两女
2694000	2696000	也是最早的
2696000	2698000	一批到达当地
2698000	2700000	他们非常辛苦
2700000	2702000	这两天他们就住在这个小镇上
2702000	2704000	因为我们的画面
2704000	2706000	但是大家可以看到
2706000	2708000	我们的画面
2708000	2710000	这些我对面那些
2710000	2712000	就可以看到很多国家
2712000	2714000	有媒体的记者
2714000	2716000	有救援人员
2716000	2718000	还有当地人员警察官员
2718000	2720000	我们新中国联邦
2720000	2722000	咱们战友的精神风貌
2722000	2724000	我们的救援物资
2724000	2726000	还有我们的救援的力量学习
2726000	2728000	都展现在全世界面前了
2728000	2730000	就像刚才文哥说的
2730000	2732000	我身边身后
2732000	2734000	文哥说的这是一个五十平米的
2734000	2736000	这样的一个架子
2736000	2738000	底下有牢固的平台
2738000	2740000	那么额外还会再做一个两百平米
2740000	2742000	就是四个这个
2742000	2744000	我们这个计划是四个两百平米
2744000	2746000	再加上它
2746000	2748000	可以给难民有一个休息区
2748000	2750000	用习惯的话说我们烤著牛排
2750000	2752000	然后来到了这个平安的地区
2752000	2754000	看著我们新中国联邦
2754000	2756000	看著我们法治基因
2756000	2758000	另外这个区可以做什么呢
2758000	2760000	我们工作人员的一个安全活动区
2760000	2762000	就像媒体接待区
2762000	2764000	这样的话我们安全媒体
2764000	2766000	食物保养东西
2766000	2768000	全部能够启动
2768000	2770000	这就体现咱们新中国联邦
2770000	2772000	救援的这种专业性安全性
2772000	2774000	所以我们正在搭建
2774000	2776000	那么这两天文哥团队
2776000	2778000	他们几位兄弟姐妹非得很辛苦
2778000	2780000	他们也在传播著爆料革命
2780000	2782000	和咱们法治基金这次善解
2782000	2784000	并且告诉他们我们有多少大巴
2784000	2786000	多少乌克兰人被追究
2786000	2788000	还有我们中国同胞被救
2788000	2790000	都得到了西方我们的这些
2790000	2792000	叫原住机构
2792000	2794000	国际原住机构同仁的尊重和认可
2794000	2796000	所以呢这个我为
2796000	2798000	我有文哥这样的兄弟
2798000	2800000	有这样的团队
2800000	2802000	文哥这兄弟也过来了
2802000	2804000	我们那个小李还有明道大哥
2804000	2806000	都在我们的这个对面
2806000	2808000	稍后呢老弟嗓子哑了
2808000	2810000	但是我让这几位兄弟多说几句
2810000	2812000	同时我为有这样的兄弟姐妹感到骄傲
2812000	2814000	谢谢七哥谢谢兄弟姐妹们
2814000	2816000	那个小李
2816000	2818000	大家都说说大卫兄弟
2818000	2820000	文哥曾一小Sara大家都说说
2820000	2822000	这个大卫最起码这几天
2822000	2824000	瘦了5磅最起码
2824000	2826000	文哥最起码瘦了3磅
2826000	2828000	曾一小Sara长了2磅
2828000	2830000	这是新冠起碰
2830000	2832000	大卫兄弟
2832000	2834000	哎好啊明道兄弟
2834000	2836000	明道兄弟
2836000	2838000	太文革气兄弟
2838000	2840000	哎好小李
2840000	2842000	小李小李小李
2842000	2844000	哇塞大卫这几年居居在前线
2844000	2846000	太好太好小李
2846000	2848000	小李明道兄弟文革
2848000	2850000	太好了你们说几句你们太棒了
2850000	2852000	太棒了
2852000	2854000	我真的是发自心爱你们
2854000	2856000	兄弟们
2856000	2858000	还有我们现场大卫兄弟我们联盟委员会的
2858000	2860000	主席啊秘书长
2860000	2862000	唐宝哥老班长还有我们的
2862000	2864000	大卫兄弟的现场总指挥
2864000	2866000	太给力了我们所有的战友
2866000	2868000	第一时间出到前线所有物资
2868000	2870000	昨天夜里到位文科兄弟
2870000	2872000	现场站位还有我们的帐目
2872000	2874000	是专线写的
2874000	2876000	所有的救援团队都没有我们的牛啊
2876000	2878000	我们给这些
2878000	2880000	所有的这个国际友人这些朋友
2880000	2882000	这些逃难出来的我们这些人
2882000	2884000	给他们这个提供食物
2884000	2886000	还有我们这个毛毯他们
2886000	2888000	真的非常感动特别特别棒
2888000	2890000	我为我是新中国
2890000	2892000	联盟人而感到骄傲和自豪
2892000	2894000	谢谢鸡哥谢谢战友们
2894000	2896000	谢谢大家
2896000	2898000	真的是今天的天气
