start	end	text
0	3320	就为什么一开始的时候我觉得这个真的是
3580	6400	时间就是不以我们意志为转移的
6660	9220	那么以前七哥也讲过这个2019年
9480	9980	是
10240	12800	人类历史上可能是就最好的一年
13060	17160	当时还没那么深的感受现在是绝对有深刻那我想问一下七哥就是
17400	22020	您在那么早之前就是通过各方面渠道
22280	26880	渠道当时对这个5月份202年这个时间点你是怎么判断的现在
27140	29440	是不是像你预期一样是会更好还是更坏
30000	35840	谢谢罗一兄弟啊我觉得我过去几十年我就像刚才讲到
36100	38400	这个轴心法和轴心论
38920	42500	还有个轴心文化中心我是走了全世界
43520	49160	还有一个我在中国海东兄弟老在昆仑搞流水是吧找有妹妹打高尔夫
49420	52220	我是天天变坊所谓的高人了
53240	55560	我走特别我到了埃及呀
55780	61660	我走特别我到了埃及呀就埃及是世界上最好的穆斯林大学
63200	66780	大家可以看一下最好的穆斯林大学就是他不是极端的
67280	70100	他也不是所谓被控制的他还算是和平的
70880	73180	最好的埃及的穆斯林大学
73940	77020	我到了这个慕尼黑的
77280	79060	到了德国的几个大学
79580	80600	包括剑桥啊
80800	85320	英国什么理工啊什么什么日本的东京大学呀是吧
85580	88360	包括到非洲开普通学校我都去过
88620	92680	太多学校教堂宗教神学社我都去拜访
93960	98480	特别是在德国的还有俄罗斯的所谓的马克思主义研究所
98980	101680	斯里兰卡的马克思主义研究所国际共产主义研究所
110760	112600	我去过德国的几个大学
112840	114640	我都去过德国的几个大学
114880	116440	我都去过德国的几个大学
116680	118120	我都去过德国的几个大学
118360	119880	我都去过德国的几个大学
120120	121680	我都去过德国的几个大学
121920	123560	我都去过德国的几个大学
123800	125360	我都去过德国的几个大学
125600	127200	我都去过德国的几个大学
127440	128960	我都去过德国的几个大学
129200	130720	我都去过德国的几个大学
130960	132560	我都去过德国的几个大学
132800	134560	我都去过德国的几个大学
134800	136560	我都去过德国的几个大学
136800	138440	我都去过德国的几个大学
138880	141480	我们 execute....
158120	160480	已经断了是吗
161720	163080	现在声音可以
164120	165960	对我看了海东兄弟
166040	167720	他俩都断了
167720	168720	他俩都不动了
168720	172720	今天我们还不给海东店的给这张影子做一件事
173720	175720	他俩不动的我们都是不动的
177720	178720	墨金现在
178720	180720	现在那个声音可以吗
180720	181720	声音出去了吗
181720	182720	可以可以
182720	183720	这声音都救我都不行了
183720	184720	救我都不行了
185720	187720	对其实就是你这卡座
188720	189720	是吧
189720	191720	那行那我就接着说吧好吧
191720	192720	声音没问题
193720	194720	只能接着说吧
194720	195720	就当宝箔吧
195720	196720	好吧
196720	197720	你们该冲击的东西该看看的
197720	199720	得 没冲击的提醒我啊
200720	202720	我想给大家说个信息
202720	204720	当你看到这个的时候
204720	206720	2019年就是年月经济
206720	207720	大家记住啊
207720	208720	什么时候开始的
208720	210720	你们查一查2011年
211720	212720	到2011年
213720	215720	这个时候公共和谐最恶劣的
215720	220720	就是两个所谓的两国治理世界的理论
220720	222720	就两个超级大国信心关系
222720	223720	就是中美两国
223720	224720	和两国治理
224720	228720	从过去的所谓的一个一级管理世界
228720	229720	要两级了
230720	233720	在这一系列的背后我知道共产大厦
253720	254720	罗姨啊
255720	256720	罗姨啊
258720	259720	罗姨
260720	261720	罗姨也没声音了
262720	263720	都没声音了大家
263720	264720	这真都给黑了啊
265720	266720	我靠
269720	271720	没有我的声音是吧
271720	272720	罗姨你说句话
272720	273720	有我的声音
273720	275720	那就是文贵先生去断了是吧
276720	277720	这个挺好
278720	279720	这个乱聊直播
279720	281720	大家自由发挥
284720	286720	好的等这个再连上来吧
287720	288720	不仅没声音了
288720	289720	让你连画面也没了
290720	292720	文贵先生那边应该要重启
293720	295720	给你踢出群
297720	298720	罗姨聊聊
298720	301720	没有我想我特别想听赵盈姐说一下
301720	304720	因为刚才那个本来是这个东哥说完
304720	305720	然后让盈姐来说
305720	307720	然后这个文贵先生回来了
307720	309720	就是接着就就让文贵先生讲了
309720	312720	这个我想听听这个赵盈姐聊一聊
312720	315720	就是尤其是刚才那个
316720	319720	七哥说的那段关于体育关于就是范志毅啊
319720	320720	就是他们这些人
320720	322720	因为对我们这些年轻人来说
322720	326720	我是从小看着这个赵盈姐和海东哥和这足球
326720	327720	是从小看长大的
328720	330720	那当时02年世界杯的时候是吧
330720	332720	然后这个特别激动坐在电视前面
332720	334720	然后就一直在这在这看
334720	337720	然后说第一次这个中国足球出现了
337720	341720	然后这个范志毅和东哥这些名字都出现在一起
341720	347720	但是像刚刚七哥讲的这种绝对的一个区别
347720	351720	就是像范志毅像这些国内的所谓的这些网红和明星
351720	353720	他们现在就是完全没有任何自由
353720	356720	连一个猪和狗和猫的自由都没有
356720	359720	和现在这个东哥盈姐您刚分享生活
359720	362720	和看到的所有和现在能在这发生这种对比
362720	366720	想听听这个赵盈姐能不能给我们分享一下这个
366720	368720	您的一个体悟
372720	376720	对我其实就是一个
376720	382720	最近看到的一些这种这种观察的一些感受吧
382720	388720	就是就发现就是真的很多人不像之前
388720	396720	像那个有什么经常有谁谁在什么微博的什么头条啊
396720	403720	什么这些里面你现在发现你看很多的这些明星都没有了
403720	405720	那就是很奇怪的一个现象
405720	410720	为什么突然间很多的这些明星都不上头条了
410720	422720	包括他们背后的那些推手这些公司都好像很安静了
422720	426720	我就觉得这是一个现象
426720	434720	包括这么长时间了也没有说真正有人站出来发声
434720	444720	当然可能他们都是在这个都是在墙内肯定这个东西也不能像我们这样子站出来发声
444720	452720	反正就是各种这种情况的一个综合觉得也是很奇怪
452720	470720	也是这个这个就是让我的感觉就是也是不能就是说像这个像潘志毅在上海肯定是有点有点什么事我我自己感觉
470720	472720	感觉好
472720	476720	谢谢张一姐我是
476720	479720	画面挡住了啊
479720	481720	没见了
481720	484720	好了刚刚这个群里边是谁问的
484720	486720	是问我这个
486720	488720	三秒前我了解世界非洲出生了吗
488720	495720	出生了当时我还看着这个第一场应该是对那个哥斯达黎加吧
495720	497720	我当时就是
497720	499720	坐在那个
499720	503720	哎文贵先生回来了
503720	510720	文贵先生能听到我们说话吗您现在回来了
510720	515720	现在又回来了
515720	519720	文贵先生您看现在哎又黑了
519720	524720	文贵先生您看这样行吗就刚刚那个导演小福利跟我沟通一下
524720	532720	就说现在能不能现在您接着说然后一会如果说不稳定的话就给您一个画面我们就不要切我们画面了
532720	537720	就是给您一个画面然后分享剩下那四个感受然后咱们就结束这样可以
554720	582720	给他冻结了不让他发了
582720	587720	给他冻结了不给他冻结了不给他冻结了不给他冻结了
587720	592720	所有这人都是就是有这个所谓的不良倾向的没有粉红思想的
592720	607720	走给你
607720	615720	现在声音还有吗现在声音能听到
637720	656720	文清我们现在能不能就给郭先生一个框然后切过来让郭先生说完然后我们就在后边就行了
667720	696720	文贵先生您看
696720	706720	这些人别的本事没有搞破坏的本事一流真的是共产党这点确实他建设的东西不行
706720	713720	你让他建成点东西建好点东西不行他把你毁了挺挺快一会儿的吧你
713720	731720	是吧你像你那个盘古这多好的一个东西之后他就能给你据了对吧把东西变归头这帮孙子想得出来了
731720	736720	孟静现在那个郭先生那边声音能听到吗大家
736720	740720	七哥您可以接着说您现在没有发现声音可以出去
740720	744720	在墨镜在这下调
744720	749720	声音出啥都斩草出根了
749720	751720	没声音
751720	756720	连声音都给你绝了你还想
756720	771720	共产党还在议论没画面吧把你声音也给你把你嘴也捂上把你脸也给你刨了给你蒙上
771720	781720	那咱们这个现在东哥您再接着聊聊吧刚刚聊到我2022年有没有出生的问题我是出生了
781720	790720	我之前那时候第一场球是看那个就是跟哥斯达利加那场然后我当时我当时几岁啊
790720	796720	反正特别兴奋然后这个当时就后面我就玩游戏嘛
796720	807720	那当时电脑游戏就是刚有那个足球然后就然后就总我总我总用你然后进球去巴西还能赢
807720	816720	这是你看中共这个国就是为什么这个我就说嘛这个他这个国家
816720	826720	你想想中国你共产党所谓的建国1949年中华人民共产党他所谓
826720	830720	你那个唯一一次进了世界杯就是我们当时02年是吧
830720	838720	你好不记得你未来你有点历史吧你聊点什么东西这帮狮子你五里河那全炸了
838720	846720	我们的那个有一个就是放在那个浇宿全炸完扔了就你就不明白
846720	853720	我们所有的东西在人家韩国的这个世界杯的局场里我们的照片什么的还都在啊
853720	863720	现在还都在啊我们这些你说他没意思对吧他也是给你帐给你毁了这就是共产党
863720	872720	你说他们能好吗你说他拿什么东西再来教育下面的人是吧你老说这个不好吗
872720	881720	现在能看到我吗
881720	898720	我接着说是吧我想说的事情就是说刚才接着刚才说的话
898720	906720	现在整个目前我们能看到的这个整个是2019年是人类上政治经济达到最顶峰
906720	918720	然后就把共产党的所有的他的这个经济的和奴隶化的能量吧结果就变成了共产党的野心
918720	924720	那么共产党必将图谋所谓他的大义
924720	933720	就是美国和西方的所有的随情政策和美国和西方的所有的无知的政治家和哲学家
933720	943720	被收买后的弥灭良性所谓用贸易让共产党能改变从魔鬼变成一个西方的民主社会的这个负责任的国家
943720	945720	他彻底失败了
945720	953720	那么我又是知道共产党的所谓的一三五七九我又是知道共产党的
953720	957720	又没声音了
957720	959720	现在好了吧
959720	961720	现在有声音吧
961720	966720	还有所有的所谓的共产党的蓝金黄金黄和对美计划
966720	971720	大家知道这就是咱们为什么说他2019年是最高峰
972720	975720	习近平要想搞
989720	991720	看见病毒发生以后啊
991720	994720	咱们非常清楚根据情报根据我过去了解
994720	997720	这是一场生化武器战争
997720	1002720	而且我们知道生化武器战争最终的疫苗是真正的目的
1002720	1007720	这个目的的最后必将将人类带入黑暗
1007720	1010720	这就是说现在洛伊说的
1010720	1014720	为什么我们从2019到现在和2017到现在
1014720	1021720	是基于我和共产党打交道掌握的情报和变反世界
1027720	1030720	一个客观的最后的一个结果
1030720	1033720	这就是为什么现在你看到在世界上
1033720	1038720	所谓的社交媒体和主流媒体上一片胡言乱语
1038720	1042720	就没有任何人严肃认真面对过这个问题的背后的本质
1042720	1048720	他就是上镜头前提前两天准备工作胡编乱造编得让你信
1048720	1052720	他根本没有顾及到事实共产主义
1052720	1057720	和共产主义来到中国和在中国人民嘴身活着之中
1057720	1064720	还有世界上经济和政治军事上这场冲突到来的根本的本质
1064720	1066720	谢谢洛伊 谢谢
1082720	1086720	今天的南大将和耶鲁和东帝影妹妹你们老听着都不好意思了
1086720	1089720	我一个人在那儿吓唬砍都没劲呢
1089720	1093720	我想说的第二个我感受最深的是
1093720	1097720	这是过去我从来没有过真的没有过
1097720	1106720	在生活中新中国联邦受到全世界政治、经济和文化
1106720	1110720	所有领域的全面关注我是从来没有感受到
1110720	1115720	说实在我从来没有说咱们新中国联邦怎么着怎么着牛都不行了
1115720	1117720	我们要保持冷静
1117720	1122720	我是第一次真正的感受到新中国联邦爆料革命
1122720	1126720	特别是我们追求的理念消灭中国共产党
1126720	1130720	受到了全世界全面的关注
1130720	1132720	我举一个最简单的例子
1132720	1135720	我参加了几个秘密的视频会
1135720	1139720	过去的时候人最多的就是170个人
1140720	1144720	而这几次每次都是最高容量300个人
1144720	1147720	而且300个人背后都告诉说
1147720	1149720	大概每个人背后都一两百个人
1149720	1155720	也就是几千个人在听我阐述新中国联邦和爆料革命
1155720	1157720	干掉中国共产党
1157720	1160720	这是我真的是从来没有过
1160720	1164720	我就觉得我们新中国联邦这个事真的是成了大事了
1164720	1166720	而且经济领域、政治领域
1166720	1169720	包括各种机构全面关注
1169720	1174720	第三个我从来没有像最近感受到
1174720	1181720	就在美国真的是爆料革命和灭共的事业深入人心
1181720	1183720	我举个最简单的例子
1183720	1185720	我去某个机构开会
1185720	1188720	我们后面保镖还有旁边的人
1188720	1191720	团队大家都知道都是和强时代
1191720	1194720	人家都是过去要脱掉鞋
1194720	1195720	要解掉腰带
1195720	1200720	把包放到整个红外线扫描机里面去
1200720	1201720	我一过来的时候
1201720	1202720	人家旁边几个人说
1202720	1204720	Miles你今天不直播了吧
1204720	1205720	直播不了了
1205720	1206720	我说是啊
1211720	1215720	就我不用脱鞋也不用扎腰带就过去了
1215720	1218720	一天三进三出都是这样
1218720	1221720	当我在里面开会的时候
1221720	1227720	我很特意的被送到两次前面几瓶超级的水
1227720	1229720	人家都喝了一般的一块多美金的水
1229720	1231720	给我送的都是好水
1231720	1232720	给我送几次过来
1232720	1235720	无论是什么皮肤颜色的
1235720	1238720	非洲裔亚洲裔还是美国人
1238720	1242720	对我那种尊敬对我那种照顾
1242720	1244720	这在美国真的是
1244720	1245720	你过去有
1245720	1247720	但是一种大家都一样的
1247720	1250720	这次被完全特别待遇特别照顾
1251720	1255720	迫身就是它渗入了各个领域
1255720	1258720	另外一个我这事儿参加另外一个会的时候呢
1258720	1260720	这个让我感受更深的事情
1260720	1261720	旁边说了半天了
1261720	1263720	发现是咱们战友
1263720	1266720	突然说了一句
1266720	1267720	separately
1267720	1270720	把我吓一大跳
1270720	1273720	这种事情最近发生时代太多
1273720	1276720	最后我们总结到一个经济领域
1276720	1277720	也就是说最近啊
1277720	1281560	说最近所有的我希望这些投资者
1281560	1285960	能尽快的完善这一系列的投资
1285960	1289120	让咱们战友们能有更多的钱
1289120	1290720	咱们去灭共去
1290720	1294120	过去谈的时候都是在上言上
1294120	1297640	或者说支持我们的追求
1297640	1300120	但是人家是在上言上
1300120	1302360	但是现在多了一份情感
1302360	1303760	而且他们深信
1303760	1306200	我们战友们最终会消灭中国共产党
1306640	1309960	而且他们也相信他们未来的利益
1309960	1312000	和我们的爆料革命是紧紧连在一起的
1313240	1316160	这是一个巨大的突破
1316160	1317920	巨大的突破
1317920	1321080	这都是从来没有过的
1321080	1321840	另外一个呢
1321840	1323160	我现在第四个我想说一下
1323160	1326120	就是我感受更深的
1326120	1331200	让我这是最近有点真的是不知所措的事情
1331200	1333040	就是现在国内
1333040	1336040	我从来没有感受到国内的体制内啊
1336080	1338760	还有这个社会上各个领域
1338760	1340200	真正的很多人醒来
1341960	1343640	原来真的没有过
1343640	1347520	每次都很兴奋的感到很多人加入啊
1347520	1349840	很多人真心支持我们
1349840	1353040	大多数人都是有前仇
1353040	1355400	个人的仇恨或者各种原因
1355400	1357160	经历了极客爆料革命
1357160	1361120	而现在加入到我们的党内的体制内的很多人
1361160	1362360	列如啊
1362360	1365760	列如向我提供各方面情报的人
1366720	1369800	和过去比是完全不一样的
1369800	1371240	不是一个量级的
1372600	1376400	特别是像在这个隔离前和隔离后
1376400	1377560	隔离期间
1377560	1382160	向我提供中国共产党在中国所有犯下的罪行
1382160	1383400	经济情报
1383400	1385440	军事情报
1385440	1386960	科技领域
1386960	1388280	重大角色
1388280	1392720	包括对世界上额无之间的这所有的前线的事情
1392720	1394720	说实在真的不是一个级别
1394720	1395760	这让我感受到
1396960	1401440	爆料革命和新中国联邦在国内的影响力远远超出我们想象
1402800	1404480	这是我从来没有感受到的
1405440	1407200	从来没有啊
1407200	1411840	最后一个我想是说到一个从来没有感受到的更重要的核心
1412840	1417240	我从来没有想到我们真的在经济领域有这么大的影响力
1419000	1421520	没有想到战友们一起啊
1421520	1423440	参与的G系列
1424560	1426480	特别是洗联储洗币
1427480	1433320	特别是洗币和HPAY将给很多金融家
1433320	1435600	经济家带来的希望和震撼
1437120	1438240	包括盖特
1438240	1439360	包括老GTV
1439360	1440160	包括Gnews
1441120	1446680	这些都是原来我认为国内很多人会服很佩服
1446680	1447760	但是呢
1447760	1449480	走到这个国际战略
1449480	1453600	国家战略与人类的命运连在一起
1453600	1456240	我还真是没有想到有这么严重
1456240	1458200	这么快速的发展啊
1458200	1460840	而且引来了很多专家的投入
1461960	1463760	我举个最简单的例子
1463760	1469120	我特别想知道所谓的中国人民币的数字人民币
1469120	1469880	在香港
1470800	1472000	在恒生
1472040	1474160	跌破一万八千点
1474160	1475520	推广人民币
1475520	1479200	和俄罗斯要下一步和人民币挂钩
1479200	1482880	这一系列的数据的背后对我们太重要了
1482880	1488080	因为它事关我们战友们未来在洗币上的所有的利益和未来的走向
1489440	1490880	这在过去是很难获得的
1490880	1492760	现在可以说我们轻易就能获得了
1494280	1499440	俄罗斯要准备人民币化是冬奥会之前替哥向大家说的
1500440	1504240	现在我们知道了俄罗斯要想尽一切办法
1504240	1507280	把他的黄金和共产党连在一起
1507280	1512240	进行所谓的数字人民币和俄罗斯经济连在一起
1512240	1519120	包括可能把他所有的东欧的俄罗斯派和非洲的几个独裁国家
1519120	1520880	还有中东的国家
1520880	1521560	像伊朗啊
1521560	1522640	巴基斯坦啊
1522640	1523000	是吧
1523000	1524120	像北朝鲜呢
1524120	1525840	都紧密连在一起
1525840	1526840	如何连在一起
1526840	1528360	技术上如何连在一起
1528440	1529960	如何使用加密技术
1529960	1531720	如何使用支付系统
1531720	1533400	如何黄金挂钩
1533400	1535520	对美元确实有没有挑战
1535520	1537360	我们有什么机会
1537360	1538960	这些东西太重要了
1538960	1539880	兄弟姐妹们
1539880	1544320	这是钱和权力是无法实现的
1544320	1546480	这对我们的整个来讲太重要了
1546480	1548640	细哥作为一个顾问
1548640	1551280	作为一个战友的利益的捍卫者
1551280	1552560	得到这些信息
1552560	1554040	细哥知道怎么用
1554040	1555080	也怎么用好
1555080	1556280	这太重要了
1556280	1558480	所以说以上的这几个感受呢
1558480	1560600	我是从来没有过
1560600	1562800	就是新中国联邦
1562800	1564520	这个咱爆料革命
1564520	1568440	已经深入到世界政治经济和军事
1569440	1571480	特别是在西方
1571480	1573600	在美国欧洲
1573600	1576440	在共产党的这个上层社会啊
1576440	1578680	所谓的就是政治领域啊
1578680	1581400	我们这个有太多战友了
1581400	1583360	另外一个我也没有想到
1583360	1585520	咱们新中国联邦真的成为
1585640	1589240	世界上这么大的一个75亿的人类上
1589240	1591880	我们追求的目标
1591880	1594200	思想行为方式
1594200	1596040	包括对财富的理解啊
1596040	1598640	对人类未来的所有的规划
1598640	1600680	政道主义得到这么多
1603000	1605160	但是他得到了很多的认可
1605160	1606040	等等等吧
1606040	1607920	以上的所有的事情
1607920	1609520	让我看到我们目前啊
1609520	1611480	大家看到多维的
1612400	1614640	多维倒下来了
1614680	1615920	他不是那么简单的
1615920	1616880	我说过
1616880	1618920	他是于平海共产党
1618920	1622880	安全部在海外20年的情报机构
1622880	1626040	连一直砸锅为为职业的啊
1626040	1629160	新西兰的一个叫什么朱子朱大妈啊
1629160	1630800	包括高冰城啊
1630800	1633800	什么黄河边也都停止砸锅了
1633800	1635240	他叫金盆洗手
1635240	1637080	金盆洗手之前是干什么的
1637080	1638680	是干坏事的
1638680	1640480	他一不小心说出了本相
1640480	1642240	还有一个大家注意到没有
1642240	1644440	你们没有感受到
1644440	1647400	就跟我现在所自己每天所感受到
1647400	1649120	共产党真的没钱了
1649120	1650720	共产党对爆料革命
1650720	1651680	对新中国联邦
1651680	1653600	他真的感到恐惧了
1653600	1656200	而借新中国联邦和爆料革命
1656200	1659160	推行的一系列的法令和法规
1659160	1661760	对共产党伤害不是那么简单的
1661760	1663920	对共产党的消灭的程度
1663920	1665680	和对他的伤害程度
1665680	1668080	绝对不是你看到那么简单的
1668080	1671160	接下来Nancy移到台湾啊
1671160	1672440	到了台湾以后
1672440	1674920	共产党他有什么选择
1674920	1676680	这个时候他突然发现
1676680	1680760	共产党要想在世界上继续他作恶
1680760	1682400	他要做什么兄弟姐妹们
1682400	1685760	要在海外想尽一切办法
1685760	1687960	打压海外华人的生存空间
1689760	1692160	所有未来战友要看到
1692160	1695080	在海外共产党会拉仇恨
1695080	1696640	让更多的事情
1696640	1700920	突发事件导致海外的筹划排华
1700920	1703040	把中国人排挤到国内去
1703040	1707320	而国内现在所有的所谓的不必要的旅行
1707320	1708640	就不要旅行
1708640	1713840	和停止对海外学生所谓去留学的公正的文件
1714880	1718320	以及限制城市之间的互相流动
1718320	1720440	以及利用隔离政策
1720440	1723320	清零政策对老百姓的打压
1723320	1728920	都是准备了一场中国共产党所谓的改朝换代
1728960	1731680	实行了独裁的皇权主义
1731680	1733840	把中国人变成畜生的奴隶
1733840	1737200	畜奴都为这个准备着
1737200	1742880	老百姓过去的财富和所有的一切都将化为乌有
1742880	1745760	从共产供销集体供给
1745760	1749080	集体行动和禁足
1749080	1752280	未来就是现在从过去的清零隔离政策
1752280	1754640	很快就转成事实的
1754640	1756760	绝对没有所谓自由言论
1756760	1758240	没有社交媒体
1758240	1761320	更重要的事情就像大唐朝一样
1761320	1763160	就是夜间的戒严制度
1765320	1767760	中国人想为了想活得好
1767760	1773680	回到2019回到2015什么的2010都是不可能了
1773680	1775440	所以说我想告诉大家
1775440	1779440	新中国联邦现在有了一个历史上最伟大的责任
1779440	1780920	我最没信心的事情
1780920	1781960	消灭中国共产党
1781960	1783000	我百分之百有信心
1784160	1786040	但是能帮助中国人重建
1786040	1788520	我是一点信心没有
1788520	1790000	中国人心能不能重建
1790000	1790760	我有信心
1790760	1792040	而且会很快
1792040	1793480	但是社会能不能重建
1793480	1795320	这真的很难
1795320	1796160	为什么
1796160	1799240	这取决于中国共产党这次能给中国人留下什么
1800520	1802240	如果他对台湾开战
1802240	1803440	跟美国开战
1803440	1805560	中国被打的稀巴烂
1805560	1810520	你想恢复到现在的这个社会和中国人过去的几百年
1810520	1812200	发展到今天的这种物质社会
1812200	1812840	几乎不可能
1813840	1818240	甚至过去我认为人心最难建的人心重建
1818240	1821600	都高过现在被打烂的中国重建
1823120	1825000	而且我认为疫苗灾难
1825000	1827280	远远超过了我们大家所有的想象
1828400	1832480	现在的中国推广的给钱给老人啊
